{
  "big_picture": "This line tests physical-balance and real-time fundamental mechanisms as part of the wider goal of understanding Henry Hub before prediction or model selection.",
  "evidence_refs": [
    "research/programmes/002-henry-hub-fresh/lines/005-fundamental-balance/findings/literature-findings.json",
    "research/programmes/002-henry-hub-fresh/evidence-map.json",
    "research/programmes/002-henry-hub-fresh/feasibility-ledger.json",
    "research/programmes/002-henry-hub-fresh/feasibility-source-scan.json"
  ],
  "experiment_history": [
    {
      "experiment_id": "rep-014-monthly-real-time-forecastability"
    },
    {
      "experiment_id": "rep-012-physical-balance-drivers"
    }
  ],
  "experiment_refs": [
    {
      "experiment_id": "rep-014-monthly-real-time-forecastability",
      "path": "research/programmes/002-henry-hub-fresh/lines/005-fundamental-balance/experiments/rep-014-monthly-real-time-forecastability"
    },
    {
      "experiment_id": "rep-012-physical-balance-drivers",
      "path": "research/programmes/002-henry-hub-fresh/lines/005-fundamental-balance/experiments/rep-012-physical-balance-drivers"
    }
  ],
  "historical_facts": {
    "does_not_rule_out": "Modern production, consumption, power and LNG balance channels remain unproven by this source and require separate evidence. A separately designed PIT modern physical-balance forecast may still be tested if its source/timing contract is defensible.",
    "observed": "rep-012 independently reproduces the Roberts/Brown-Yucel source-period VECM and Table 6 physical controls. Weather deviations are positive/highly significant, storage above its five-year norm is negative/significant, and the controlled Henry Hub residual standard error falls from about 0.081 to 0.077. rep-014 remains an independently reproduced real-time forecasting result with a capacity-held translation.",
    "rules_out": "A stable Brown-Yucel oil-gas cointegrating relation cannot be assumed after 2007; Roberts' full/post-2007 break reproduces. This rules out directly promoting the historical VECM as a modern predictive model."
  },
  "legacy_research_line_ids": [],
  "programme_id": "002-henry-hub-fresh",
  "programme_interpretation": "Line 005 now contains successful source-faithful literature reproductions for rep-012 and rep-014, but still no Phase-2 predictive survivor. The rep-012 result supports source-period weather/storage physical controls while bounding direct modern use through the reproduced post-2007 structural break.",
  "remaining_untested_roles": [
    "rep-013-lng-export-demand-channel"
  ],
  "research_line_id": "005-fundamental-balance",
  "revisit_trigger": "Revisit empirical execution only after applicable HOLD/REDESIGN blockers are resolved, implementation/power contracts are verified, and the operator explicitly authorizes the transition.",
  "schema_version": 1,
  "selection_basis": "Fresh external-literature mapping under programme 002; no legacy internal result is used as scientific calibration or expected outcome.",
  "status": "active",
  "stopping_rules": {
    "empirical_execution_requires_operator_transition": true,
    "protected_outcome_access": false,
    "phase1_execution_authorized_issue": 327
  },
  "tested_role_target_horizon": "rep-012 source-period weekly Brown-Yucel/Roberts physical controls are reproduced; rep-014 source-study monthly real-time forecastability is also reproduced, but no Phase-2 predictive survivor exists.",
  "useful_secondary_observations": [
    "rep-012-physical-balance-drivers:source_period_core_reproduced_regime_break",
    "rep-013-lng-export-demand-channel:hold",
    "rep-014-monthly-real-time-forecastability:literature_reproduced_translation_capacity_hold"
  ],
  "why_zoomed_in": "Production, demand, LNG, storage and other fundamentals need source-specific timing and frequency contracts before they can support explanation or forecasting.",
  "zoom_level": "L2"
}
